<?xml version='1.0'?>
<!DOCTYPE inbentarioa SYSTEM "./inbentarioa.dtd">
<?xml-stylesheet type="text/xsl" href="./inbentarioa.xsl"?>
<inbentarioa>
    <!--Ordenagailua-->
    <ordenagailua pckodea="pc01" inpri_lotura="inpri01" switch_lotura="switch01" nunerosi="Mediamarkt" noizerosi="2024/06/13">
        <CPU>
            Intel Core i3
        </CPU>
        <Sistemaeragilea>
            Windows 11
        </Sistemaeragilea>
        <Diskogogorra>
            256GB PCIe M.2 NVMe
        </Diskogogorra>
        <Txartelgrafikoa>
            Integratua
        </Txartelgrafikoa>
        <Modeloa>
            Dell Outlet Inspiron 3891 Desktop
        </Modeloa>
        <Urtea>
            2012
        </Urtea>
        <Rammemoria>
            8GB 3200MHz DDR4 UDIMM Non-ECC
        </Rammemoria>
        <pc_irudia path="./irudiak/pckomponenteak.png"/>
    </ordenagailua>

    <ordenagailua pckodea="pc02" inpri_lotura="inpri01" switch_lotura="switch01" nunerosi="Mediamarkt" noizerosi="2024/06/13">
        <CPU>
            Intel Core i3
        </CPU>
        <Sistemaeragilea>
            Windows 11
        </Sistemaeragilea>
        <Diskogogorra>
            256GB PCIe M.2 NVMe
        </Diskogogorra>
        <Txartelgrafikoa>
            Integratua
        </Txartelgrafikoa>
        <Modeloa>
            Dell Outlet Inspiron 3891 Desktop
        </Modeloa>
        <Urtea>
            2012
        </Urtea>
        <Rammemoria>
            4GB 3200MHz DDR4 UDIMM Non-ECC
        </Rammemoria>
        <Rammemoria2>
            4GB 3200MHz DDR4 UDIMM Non-ECC
        </Rammemoria2>
        <pc_irudia path="./irudiak/pckomponenteak.png"/>
    </ordenagailua>

    <ordenagailua pckodea="pc03" inpri_lotura="inpri01" switch_lotura="switch01" nunerosi="Mediamarkt" noizerosi="2024/06/13">
        <CPU>
            Intel I3-7100
        </CPU>
        <Sistemaeragilea>
            Windows 10 Professional
        </Sistemaeragilea>
        <Diskogogorra>
            500GB
        </Diskogogorra>
        <Txartelgrafikoa>
            Integratua
        </Txartelgrafikoa>
        <Modeloa>
            Dell OptiPlex 3050 AIO
        </Modeloa>
        <Urtea>
            2018
        </Urtea>
        <Rammemoria>
            4GB
        </Rammemoria>
        <pc_irudia path="./irudiak/pckomponenteak.png"/>
    </ordenagailua>

    <ordenagailua pckodea="pc04" inpri_lotura="inpri01" switch_lotura="switch01" nunerosi="Mediamarkt" noizerosi="2024/06/13">
        <CPU>
            Intel I3-7100
        </CPU>
        <Sistemaeragilea>
            Windows 10 Professional
        </Sistemaeragilea>
        <Diskogogorra>
            500GB
        </Diskogogorra>
        <Txartelgrafikoa>
            Integratua
        </Txartelgrafikoa>
        <Modeloa>
            Dell OptiPlex 3050 AIO
        </Modeloa>
        <Urtea>
            2018
        </Urtea>
        <Rammemoria>
            4GB
        </Rammemoria>
        <pc_irudia path="./irudiak/pckomponenteak.png"/>
    </ordenagailua>

    <ordenagailua pckodea="pc05" inpri_lotura="inpri01" switch_lotura="switch01" nunerosi="Mediamarkt" noizerosi="2024/06/13">
        <CPU>
            Intel I3-7100
        </CPU>
        <Sistemaeragilea>
            Windows 10 Professional
        </Sistemaeragilea>
        <Diskogogorra>
            500GB
        </Diskogogorra>
        <Txartelgrafikoa>
            Integratua
        </Txartelgrafikoa>
        <Modeloa>
            Dell OptiPlex 3050 AIO
        </Modeloa>
        <Urtea>
            2018
        </Urtea>
        <Rammemoria>
            4GB
        </Rammemoria>
        <pc_irudia path="./irudiak/pckomponenteak.png"/>
    </ordenagailua>

    <ordenagailua pckodea="pc06" inpri_lotura="inpri02" switch_lotura="switch01" nunerosi="Mediamarkt" noizerosi="2024/06/13">
        <CPU>
            Intel Core i5
        </CPU>
        <Sistemaeragilea>
            Windows 10 Professional
        </Sistemaeragilea>
        <Diskogogorra>
            500GB HDD
        </Diskogogorra>
        <Txartelgrafikoa>
            Integratua
        </Txartelgrafikoa>
        <Modeloa>
            HP Compaq Elite 8300 MT
        </Modeloa>
        <Urtea>
            2018
        </Urtea>
        <Rammemoria>
            4GB DDR3
        </Rammemoria>
        <Rammemoria2>
            4GB DDR3
        </Rammemoria2>
        <pc_irudia path="./irudiak/pckomponenteak.png"/>
    </ordenagailua>

    <ordenagailua pckodea="pc07" inpri_lotura="inpri02" switch_lotura="switch01" nunerosi="Mediamarkt" noizerosi="2024/06/13">
        <CPU>
            Intel Core i5
        </CPU>
        <Sistemaeragilea>
            Windows 10 Professional
        </Sistemaeragilea>
        <Diskogogorra>
            500GB HDD
        </Diskogogorra>
        <Txartelgrafikoa>
            Integratua
        </Txartelgrafikoa>
        <Modeloa>
            HP Compaq Elite 8300 MT
        </Modeloa>
        <Urtea>
            2018
        </Urtea>
        <Rammemoria>
            GB DDR3
        </Rammemoria>
        <Rammemoria2>
            4GB DDR3
        </Rammemoria2>
        <pc_irudia path="./irudiak/pckomponenteak.png"/>
    </ordenagailua>

    <ordenagailua pckodea="pc08" inpri_lotura="inpri02" switch_lotura="switch02" nunerosi="Mediamarkt" noizerosi="2024/06/13">
        <CPU>
            Intel Core i5
        </CPU>
        <Sistemaeragilea>
            Windows 10 Professional
        </Sistemaeragilea>
        <Diskogogorra>
            500GB HDD
        </Diskogogorra>
        <Txartelgrafikoa>
            Integratua
        </Txartelgrafikoa>
        <Modeloa>
            HP Compaq Elite 8300 MT
        </Modeloa>
        <Urtea>
            2018
        </Urtea>
        <Rammemoria>
            4GB DDR3
        </Rammemoria>
        <Rammemoria2>
            4GB DDR3
        </Rammemoria2>
        <pc_irudia path="./irudiak/pckomponenteak.png"/>
    </ordenagailua>

    <ordenagailua pckodea="pc09" inpri_lotura="inpri02" switch_lotura="switch02" nunerosi="Mediamarkt" noizerosi="2024/06/13">
        <CPU>
            Intel Core i5
        </CPU>
        <Sistemaeragilea>
            Windows 10 Professional
        </Sistemaeragilea>
        <Diskogogorra>
            500GB HDD
        </Diskogogorra>
        <Txartelgrafikoa>
            Integratua
        </Txartelgrafikoa>
        <Modeloa>
            HP Compaq Elite 8300 MT
        </Modeloa>
        <Urtea>
            2018
        </Urtea>
        <Rammemoria>
            4GB DDR3
        </Rammemoria>
        <Rammemoria2>
            4GB DDR3
        </Rammemoria2>
        <pc_irudia path="./irudiak/pckomponenteak.png"/>
    </ordenagailua>

    <ordenagailua pckodea="pc10" inpri_lotura="inpri02" switch_lotura="switch02" nunerosi="Mediamarkt" noizerosi="2024/06/13">
        <CPU>
            Intel Core i5
        </CPU>
        <Sistemaeragilea>
            Windows 10 Professional
        </Sistemaeragilea>
        <Diskogogorra>
            500GB HDD
        </Diskogogorra>
        <Txartelgrafikoa>
            Integratua
        </Txartelgrafikoa>
        <Modeloa>
            HP Compaq Elite 8300 MT
        </Modeloa>
        <Urtea>
            2018
        </Urtea>
        <Rammemoria>
            4GB DDR3
        </Rammemoria>
        <Rammemoria2>
            4GB DDR3
        </Rammemoria2>
        <pc_irudia path="./irudiak/pckomponenteak.png"/>
    </ordenagailua>

    <ordenagailua pckodea="pc11" inpri_lotura="inpri03" switch_lotura="switch02" nunerosi="Mediamarkt" noizerosi="2024/06/13">
        <CPU>
            Intel Core i5
        </CPU>
        <Sistemaeragilea>
            Windows 10 Professional
        </Sistemaeragilea>
        <Diskogogorra>
            500GB HDD
        </Diskogogorra>
        <Txartelgrafikoa>
            Integratua
        </Txartelgrafikoa>
        <Modeloa>
            HP Compaq Elite 8300 MT
        </Modeloa>
        <Urtea>
            2018
        </Urtea>
        <Rammemoria>
            4GB DDR3
        </Rammemoria>
        <Rammemoria2>
            4GB DDR3
        </Rammemoria2>
        <pc_irudia path="./irudiak/pckomponenteak.png"/>
    </ordenagailua>

    <ordenagailua pckodea="pc12" inpri_lotura="inpri03" switch_lotura="switch02" nunerosi="Mediamarkt" noizerosi="2024/06/13">
        <CPU>
            Intel Core i5
        </CPU>
        <Sistemaeragilea>
            Windows 10 Professional
        </Sistemaeragilea>
        <Diskogogorra>
            500GB HDD
        </Diskogogorra>
        <Txartelgrafikoa>
            Integratua
        </Txartelgrafikoa>
        <Modeloa>
            HP Compaq Elite 8300 MT
        </Modeloa>
        <Urtea>
            2018
        </Urtea>
        <Rammemoria>
            4GB DDR3
        </Rammemoria>
        <Rammemoria2>
            4GB DDR3
        </Rammemoria2>
        <pc_irudia path="./irudiak/pckomponenteak.png"/>
    </ordenagailua>

    <ordenagailua pckodea="pc13" inpri_lotura="inpri03" switch_lotura="switch02" nunerosi="Mediamarkt" noizerosi="2024/06/13">
        <CPU>
            Intel Core i5
        </CPU>
        <Sistemaeragilea>
            Windows 10 Professional
        </Sistemaeragilea>
        <Diskogogorra>
            500GB HDD
        </Diskogogorra>
        <Txartelgrafikoa>
            Integratua
        </Txartelgrafikoa>
        <Modeloa>
            HP Compaq Elite 8300 MT
        </Modeloa>
        <Urtea>
            2018
        </Urtea>
        <Rammemoria>
            4GB DDR3
        </Rammemoria>
        <Rammemoria2>
            4GB DDR3
        </Rammemoria2>
        <pc_irudia path="./irudiak/pckomponenteak.png"/>